{
  "source_id": "src-a554af026ae2",
  "snapshot_sha256": "f074697b2fe9e52b047e3cb1c756d3169df6a394c4f68db7df0d68668bbaef26",
  "language": "es",
  "claims": [
    {
      "id": "src-a554af026ae2-c01",
      "assertion": "Yazhi says collective unconscious can manifest tulpa-egregors that inhabit humanlike bodies and form clans.",
      "speaker": "Yazhi",
      "paragraph_ids": [
        "p0009",
        "p0010",
        "p0017"
      ],
      "primary_topic": "egregors",
      "topics": [
        "egregors",
        "tulpas",
        "matrix-generated-persons"
      ],
      "modality": "asserted",
      "confidence": "high",
      "qualifiers": "This is her metaphysical account."
    },
    {
      "id": "src-a554af026ae2-c02",
      "assertion": "She says dark entities depend on human suffering, fear, and attention; withdrawing fear weakens them.",
      "speaker": "Yazhi",
      "paragraph_ids": [
        "p0018",
        "p0019",
        "p0021",
        "p0024",
        "p0027"
      ],
      "primary_topic": "egregors",
      "topics": [
        "egregors",
        "consciousness-metaphysics"
      ],
      "modality": "asserted",
      "confidence": "high",
      "qualifiers": ""
    },
    {
      "id": "src-a554af026ae2-c03",
      "assertion": "She says positive tulpa-egregors arise through love and integration, including starseeds; spiritual conflict reflects collective ideas.",
      "speaker": "Yazhi",
      "paragraph_ids": [
        "p0033",
        "p0034",
        "p0038",
        "p0039"
      ],
      "primary_topic": "tulpas",
      "topics": [
        "tulpas",
        "egregors",
        "consciousness-metaphysics"
      ],
      "modality": "asserted",
      "confidence": "high",
      "qualifiers": ""
    },
    {
      "id": "src-a554af026ae2-c04",
      "assertion": "She says confused individual minds shape the human collective; mental order and mass non-consent can weaken controllers.",
      "speaker": "Yazhi",
      "paragraph_ids": [
        "p0040",
        "p0041",
        "p0044",
        "p0047"
      ],
      "primary_topic": "consciousness-metaphysics",
      "topics": [
        "consciousness-metaphysics",
        "earth-cabal"
      ],
      "modality": "asserted",
      "confidence": "high",
      "qualifiers": ""
    }
  ],
  "proposed_topics": [],
  "review_flags": [
    "metaphysical-entity-origin-claims",
    "conspiracy-allegations"
  ],
  "coverage_gaps": [
    "entity-reincarnation",
    "positive-entity-populations",
    "collective-attention-mechanism"
  ]
}
