{
  "source_id": "src-ac1ba0859491",
  "snapshot_sha256": "ab1bc542f48e20be3c57965cfc0d6144a21896a91fe9bb8c450c26c7cef6b0d6",
  "language": "en",
  "claims": [
    {
      "id": "src-ac1ba0859491-c01",
      "assertion": "Mari relays the Federation claim: the Moon entered Earth orbit 12,500 years ago to stabilize Earth after Tiamat’s destruction.",
      "speaker": "Mari Swaruu",
      "paragraph_ids": [
        "p0003",
        "p0004",
        "p0005",
        "p0006"
      ],
      "primary_topic": "moon-matrix",
      "topics": [
        "moon-matrix",
        "galactic-federation"
      ],
      "modality": "reported",
      "confidence": "high",
      "qualifiers": ""
    },
    {
      "id": "src-ac1ba0859491-c02",
      "assertion": "Mari describes the Moon as a hollow ship with 144 nested spheres, hangars, control areas and engines.",
      "speaker": "Mari Swaruu",
      "paragraph_ids": [
        "p0007",
        "p0008",
        "p0009",
        "p0010"
      ],
      "primary_topic": "moon-biosphere-ship",
      "topics": [
        "moon-biosphere-ship",
        "moon-matrix",
        "starship-systems",
        "energy-generation"
      ],
      "modality": "asserted",
      "confidence": "high",
      "qualifiers": ""
    },
    {
      "id": "src-ac1ba0859491-c03",
      "assertion": "Mari describes three biosphere levels with varied ecosystems, now deactivated; she is unsure what survives.",
      "speaker": "Mari Swaruu",
      "paragraph_ids": [
        "p0011",
        "p0012",
        "p0013",
        "p0014",
        "p0018",
        "p0020"
      ],
      "primary_topic": "moon-biosphere-ship",
      "topics": [
        "moon-biosphere-ship",
        "moon-matrix",
        "starship-systems",
        "energy-generation"
      ],
      "modality": "asserted",
      "confidence": "high",
      "qualifiers": ""
    },
    {
      "id": "src-ac1ba0859491-c04",
      "assertion": "Mari says 72 core Zero Point reactors power the ship; some work, others are damaged or off as unnecessary.",
      "speaker": "Mari Swaruu",
      "paragraph_ids": [
        "p0015"
      ],
      "primary_topic": "moon-biosphere-ship",
      "topics": [
        "moon-biosphere-ship",
        "moon-matrix",
        "starship-systems",
        "energy-generation"
      ],
      "modality": "reported",
      "confidence": "high",
      "qualifiers": ""
    },
    {
      "id": "src-ac1ba0859491-c05",
      "assertion": "Mari reports 8 or 12 nuclear reactors power Earthward transmissions; count and status are uncertain.",
      "speaker": "Mari Swaruu",
      "paragraph_ids": [
        "p0023",
        "p0024"
      ],
      "primary_topic": "moon-matrix",
      "topics": [
        "moon-matrix",
        "galactic-federation"
      ],
      "modality": "reported",
      "confidence": "high",
      "qualifiers": ""
    }
  ],
  "proposed_topics": [
    {
      "id": "moon-biosphere-ship",
      "name": "The Moon as a biosphere ship",
      "kind": "location-technology",
      "aliases": [
        "lunar biosphere ship",
        "Moon ship"
      ]
    }
  ],
  "review_flags": [],
  "coverage_gaps": [
    "uncovered-subtopics"
  ]
}
