{
  "source_id": "src-b24a05072ad7",
  "snapshot_sha256": "da38798b403f09058fbe2984a10c618f42a89da2ee16824914265921a68fb5b6",
  "language": "es",
  "claims": [
    {
      "id": "src-b24a05072ad7-c01",
      "assertion": "Swaruu calls 3D Matrix a frequency suppressor; its hack combines technology and beliefs that steer collective reality.",
      "speaker": "Swaruu",
      "paragraph_ids": [
        "p0006",
        "p0014",
        "p0016",
        "p0026"
      ],
      "primary_topic": "moon-matrix",
      "topics": [
        "moon-matrix",
        "original-matrix",
        "consciousness-metaphysics"
      ],
      "modality": "asserted",
      "confidence": "high",
      "qualifiers": ""
    },
    {
      "id": "src-b24a05072ad7-c02",
      "assertion": "She says Reptiles altered lunar Matrix computers around 1960; after 12,500 neglected years, Taygetans took control in 2008.",
      "speaker": "Swaruu",
      "paragraph_ids": [
        "p0016",
        "p0018",
        "p0048",
        "p0050",
        "p0052"
      ],
      "primary_topic": "moon-matrix",
      "topics": [
        "moon-matrix",
        "taygetans",
        "timeline-branching"
      ],
      "modality": "asserted",
      "confidence": "high",
      "qualifiers": ""
    },
    {
      "id": "src-b24a05072ad7-c03",
      "assertion": "Swaruu names imposed religion, mass media, microwave and HAARP control, and reptilian spaceflight as Matrix-hacking milestones.",
      "speaker": "Swaruu",
      "paragraph_ids": [
        "p0026",
        "p0034",
        "p0040"
      ],
      "primary_topic": "moon-matrix",
      "topics": [
        "moon-matrix",
        "weather-control",
        "earth-cabal"
      ],
      "modality": "asserted",
      "confidence": "high",
      "qualifiers": ""
    },
    {
      "id": "src-b24a05072ad7-c04",
      "assertion": "She claims Reptiles intercept the dead in lower astral or 4D, invoke karma, and compel reincarnation.",
      "speaker": "Swaruu",
      "paragraph_ids": [
        "p0038"
      ],
      "primary_topic": "postmortem-realities",
      "topics": [
        "postmortem-realities",
        "moon-matrix"
      ],
      "modality": "asserted",
      "confidence": "high",
      "qualifiers": ""
    }
  ],
  "proposed_topics": [],
  "review_flags": [
    "Compared English counterpart src-1db159fdbe8d in full; closely equivalent translation with paragraph segmentation shifts. Spanish p0052 specifies Taygetans coordinate militarily from 5D; English p0054 omits that detail."
  ],
  "coverage_gaps": [
    "religious-history-claims",
    "worker-control-claims",
    "Tiamat-aftermath"
  ]
}
