{
  "source_id": "src-fba00f670b62",
  "snapshot_sha256": "91b00c9d4149c871faf4346e76a19966e7976b22d6e8ecd8fe9b491184fb2ec7",
  "language": "es",
  "claims": [
    {
      "id": "src-fba00f670b62-c01",
      "assertion": "Swaruu says Tiamat, a large water planet nearer than Mars, was destroyed 12,500 years ago and became the asteroid belt.",
      "speaker": "Swaruu (9)",
      "paragraph_ids": [
        "p0004",
        "p0005"
      ],
      "primary_topic": "tiamat",
      "topics": [
        "tiamat",
        "terrestrial-science"
      ],
      "modality": "asserted",
      "confidence": "high",
      "qualifiers": ""
    },
    {
      "id": "src-fba00f670b62-c02",
      "assertion": "She says Nibiru and Hercóbulus will not return and denies a binary sun or Nemesis brown dwarf.",
      "speaker": "Swaruu (9)",
      "paragraph_ids": [
        "p0006",
        "p0008"
      ],
      "primary_topic": "terrestrial-science",
      "topics": [
        "terrestrial-science",
        "tiamat"
      ],
      "modality": "asserted",
      "confidence": "high",
      "qualifiers": ""
    },
    {
      "id": "src-fba00f670b62-c03",
      "assertion": "She attributes the system’s missing mass to three smaller objects, not a large incoming planet.",
      "speaker": "Swaruu (9)",
      "paragraph_ids": [
        "p0007"
      ],
      "primary_topic": "terrestrial-science",
      "topics": [
        "terrestrial-science"
      ],
      "modality": "asserted",
      "confidence": "high",
      "qualifiers": ""
    },
    {
      "id": "src-fba00f670b62-c04",
      "assertion": "She links human trauma to Tiamat’s cataclysm and earlier near-extinction persecution by a Reptilian alliance.",
      "speaker": "Swaruu (9)",
      "paragraph_ids": [
        "p0009"
      ],
      "primary_topic": "reptilians",
      "topics": [
        "reptilians",
        "tiamat"
      ],
      "modality": "speculative",
      "confidence": "high",
      "qualifiers": "She attributes the cataclysm link to Michael Tsarion."
    }
  ],
  "proposed_topics": [],
  "review_flags": [
    "translation-counterpart:src-70fb5038443a-close; English adds context and 13-planet claims"
  ],
  "coverage_gaps": [
    "Tiamat environmental description",
    "Nemesis argument",
    "solar-system missing-mass model"
  ]
}
