{
  "source_id": "src-6ac316dc19d4",
  "snapshot_sha256": "67c40d6727665c494f24a4c407d1857816825c196e5734fd0bd032b3593ba5a0",
  "language": "en",
  "claims": [
    {
      "id": "src-6ac316dc19d4-c01",
      "assertion": "Mari offers the higher self as a more evolved version, including one’s wiser future self.",
      "speaker": "Mari Swaruu",
      "paragraph_ids": [
        "p0002",
        "p0003",
        "p0004",
        "p0005",
        "p0006",
        "p0007",
        "p0008"
      ],
      "primary_topic": "consciousness-metaphysics",
      "topics": [
        "consciousness-metaphysics"
      ],
      "modality": "asserted",
      "confidence": "high",
      "qualifiers": ""
    },
    {
      "id": "src-6ac316dc19d4-c02",
      "assertion": "She says nonlinear time permits versions of oneself to coexist.",
      "speaker": "Mari Swaruu",
      "paragraph_ids": [
        "p0002",
        "p0009",
        "p0010",
        "p0011",
        "p0012"
      ],
      "primary_topic": "consciousness-metaphysics",
      "topics": [
        "consciousness-metaphysics"
      ],
      "modality": "asserted",
      "confidence": "high",
      "qualifiers": ""
    },
    {
      "id": "src-6ac316dc19d4-c03",
      "assertion": "She describes higher selves as atemporal consciousnesses encompassing incarnated versions.",
      "speaker": "Mari Swaruu",
      "paragraph_ids": [
        "p0002",
        "p0013",
        "p0014",
        "p0015",
        "p0016",
        "p0017"
      ],
      "primary_topic": "consciousness-metaphysics",
      "topics": [
        "consciousness-metaphysics"
      ],
      "modality": "asserted",
      "confidence": "high",
      "qualifiers": ""
    },
    {
      "id": "src-6ac316dc19d4-c04",
      "assertion": "She cautions against treating another person’s suffering as a tool for higher-self growth.",
      "speaker": "Mari Swaruu",
      "paragraph_ids": [
        "p0002",
        "p0018"
      ],
      "primary_topic": "consciousness-metaphysics",
      "topics": [
        "consciousness-metaphysics"
      ],
      "modality": "asserted",
      "confidence": "high",
      "qualifiers": ""
    },
    {
      "id": "src-6ac316dc19d4-c05",
      "assertion": "She says embodiment itself does not limit spiritual status; ideas and attachments do.",
      "speaker": "Mari Swaruu",
      "paragraph_ids": [
        "p0002",
        "p0019",
        "p0020",
        "p0021"
      ],
      "primary_topic": "consciousness-metaphysics",
      "topics": [
        "consciousness-metaphysics"
      ],
      "modality": "asserted",
      "confidence": "high",
      "qualifiers": ""
    }
  ],
  "proposed_topics": [],
  "review_flags": [],
  "coverage_gaps": [
    "higher-self-model",
    "coexisting-timelines"
  ]
}
